Geo_FIPS,Geo_GEOID,Geo_NAME,housingunits,occupied,vacant,vacant_rental,vacant_sale,vacant_other,med_rent,med_rir,vacrate
10100,31000US10100,"Aberdeen, SD Micro Area",19061,17383,1678,348,180,1150,587,25.2999992370605,0.088033156707413
10140,31000US10140,"Aberdeen, WA Micro Area",35208,27318,7890,611,668,6611,732,29.5,0.224096796182686
10180,31000US10180,"Abilene, TX Metro Area",70174,60343,9831,2161,803,6867,768,29.8999996185303,0.14009462193975
10220,31000US10220,"Ada, OK Micro Area",16674,14650,2024,620,238,1166,635,29.6000003814697,0.121386589900444
10260,31000US10260,"Adjuntas, PR Micro Area",7514,6178,1336,85,106,1145,367,37,0.177801437317008
10300,31000US10300,"Adrian, MI Micro Area",43439,37859,5580,441,421,4718,724,31.7000007629395,0.128455995764175
10380,31000US10380,"Aguadilla-Isabela, PR Metro Area",144035,109620,34415,3872,2685,27858,405,35.4000015258789,0.238934981080987
10420,31000US10420,"Akron, OH Metro Area",312993,281752,31241,7430,3358,20453,753,30.5,0.099813733853473
10460,31000US10460,"Alamogordo, NM Micro Area",30982,23907,7075,274,573,6228,775,27.2000007629395,0.228358401652572
10500,31000US10500,"Albany, GA Metro Area",66257,58250,8007,2607,563,4837,710,34.0999984741211,0.120847608554568
10540,31000US10540,"Albany, OR Metro Area",48988,44942,4046,998,563,2485,808,33.2000007629395,0.082591655099208
10580,31000US10580,"Albany-Schenectady-Troy, NY Metro Area",395107,347401,47706,6518,3491,37697,905,29.2000007629395,0.120741976224162
10620,31000US10620,"Albemarle, NC Micro Area",27178,23484,3694,526,329,2839,645,32,0.135918757818824
10660,31000US10660,"Albert Lea, MN Micro Area",14209,13077,1132,298,86,748,554,26.8999996185303,0.079667816172848
10700,31000US10700,"Albertville, AL Micro Area",40329,34524,5805,598,687,4520,593,27.2999992370605,0.143941084579335
10740,31000US10740,"Albuquerque, NM Metro Area",377475,344168,33307,8565,4146,20596,811,31.6000003814697,0.088236307040201
10780,31000US10780,"Alexandria, LA Metro Area",65406,54908,10498,1399,527,8572,726,31.8999996185303,0.160505152432499
10820,31000US10820,"Alexandria, MN Micro Area",20265,15639,4626,447,51,4128,685,30.3999996185303,0.228275351591414
10860,31000US10860,"Alice, TX Micro Area",16199,13488,2711,139,38,2534,727,26.3999996185303,0.167356009630224
10900,31000US10900,"Allentown-Bethlehem-Easton, PA-NJ Metro Area",343357,313786,29571,6763,4045,18763,934,32.2999992370605,0.086123189566545
10940,31000US10940,"Alma, MI Micro Area",16259,14705,1554,184,159,1211,586,32.5,0.095577833815118
10980,31000US10980,"Alpena, MI Micro Area",15989,12860,3129,126,273,2730,550,29.7999992370605,0.19569704171618
11020,31000US11020,"Altoona, PA Metro Area",56211,50948,5263,799,435,4029,630,28.8999996185303,0.093629360801267
11060,31000US11060,"Altus, OK Micro Area",12106,10407,1699,250,280,1169,685,26.2000007629395,0.140343631257228
11100,31000US11100,"Amarillo, TX Metro Area",105230,95576,9654,2690,1016,5948,749,28.8999996185303,0.09174189869809
11140,31000US11140,"Americus, GA Micro Area",16201,13541,2660,404,282,1974,611,29.3999996185303,0.164187395839763
11180,31000US11180,"Ames, IA Metro Area",37350,35666,1684,276,193,1215,760,35.0999984741211,0.045087014725569
11220,31000US11220,"Amsterdam, NY Micro Area",23159,19655,3504,316,392,2796,702,30.7000007629395,0.151301869683492
11260,31000US11260,"Anchorage, AK Metro Area",155079,136268,18811,2270,1413,15128,1159,28.8999996185303,0.121299466723412
11380,31000US11380,"Andrews, TX Micro Area",5935,5412,523,0,110,413,869,23.5,0.088121314237574
11420,31000US11420,"Angola, IN Micro Area",19418,13409,6009,308,573,5128,650,27.2000007629395,0.309455144711093
11460,31000US11460,"Ann Arbor, MI Metro Area",148106,136471,11635,2449,1265,7921,938,32.0999984741211,0.078558599921678
11500,31000US11500,"Anniston-Oxford-Jacksonville, AL Metro Area",53306,45348,7958,603,993,6362,634,30.7999992370605,0.149289010617942
11540,31000US11540,"Appleton, WI Metro Area",93992,88750,5242,1280,1139,2823,721,25.2999992370605,0.055770703889693
11580,31000US11580,"Arcadia, FL Micro Area",14664,10964,3700,448,354,2898,686,28.6000003814697,0.252318603382433
11620,31000US11620,"Ardmore, OK Micro Area",21321,17475,3846,1199,345,2302,668,26.2999992370605,0.180385535387646
11640,31000US11640,"Arecibo, PR Metro Area",81685,67223,14462,1017,1015,12430,416,34.2999992370605,0.177045969272204
11660,31000US11660,"Arkadelphia, AR Micro Area",10393,8467,1926,286,118,1522,604,30.7999992370605,0.185317040315597
11680,31000US11680,"Arkansas City-Winfield, KS Micro Area",15995,13783,2212,297,355,1560,625,29.2000007629395,0.138293216630197
11700,31000US11700,"Asheville, NC Metro Area",215589,181793,33796,2842,3145,27809,789,30.5,0.156761244775939
11740,31000US11740,"Ashland, OH Micro Area",22112,20339,1773,235,243,1295,681,24.1000003814697,0.080182706222866
11780,31000US11780,"Ashtabula, OH Micro Area",45964,38933,7031,961,805,5265,631,33.9000015258789,0.152967539813767
11820,31000US11820,"Astoria, OR Micro Area",21693,15746,5947,641,295,5011,825,32,0.274143733001429
11860,31000US11860,"Atchison, KS Micro Area",6971,6180,791,182,60,549,622,25.6000003814697,0.113470090374408
11900,31000US11900,"Athens, OH Micro Area",26315,22208,4107,778,407,2922,703,43.0999984741211,0.156070682120464
11940,31000US11940,"Athens, TN Micro Area",23301,20187,3114,511,467,2136,590,30.7999992370605,0.133642332947084
11980,31000US11980,"Athens, TX Micro Area",39777,29820,9957,507,830,8620,739,32.0999984741211,0.25032053699374
12020,31000US12020,"Athens-Clarke County, GA Metro Area",82159,68975,13184,4722,1429,7033,791,35.9000015258789,0.160469333852652
12060,31000US12060,"Atlanta-Sandy Springs-Roswell, GA Metro Area",2189138,1936823,252315,77390,40092,134833,970,31.6000003814697,0.115257695037956
12100,31000US12100,"Atlantic City-Hammonton, NJ Metro Area",127104,101166,25938,2740,1810,21388,1043,35.4000015258789,0.204069108761329
12140,31000US12140,"Auburn, IN Micro Area",17574,16235,1339,391,255,693,648,26.1000003814697,0.076192101968818
12180,31000US12180,"Auburn, NY Micro Area",36441,30907,5534,424,424,4686,666,28.2000007629395,0.151861913778436
12220,31000US12220,"Auburn-Opelika, AL Metro Area",64258,56637,7621,1467,1234,4920,777,36.5,0.118600018674718
12260,31000US12260,"Augusta-Richmond County, GA-SC Metro Area",245526,208736,36790,6931,4604,25255,767,31.3999996185303,0.149841564640812
12300,31000US12300,"Augusta-Waterville, ME Micro Area",61220,51242,9978,875,871,8232,704,30.7999992370605,0.162985952303169
12380,31000US12380,"Austin, MN Micro Area",16999,15511,1488,203,343,942,711,31.6000003814697,0.087534560856521
12420,31000US12420,"Austin-Round Rock, TX Metro Area",731966,673901,58065,16286,6935,34844,1014,30.7000007629395,0.079327455100374
12460,31000US12460,"Bainbridge, GA Micro Area",12135,10473,1662,284,126,1252,630,34,0.136959208899876
12540,31000US12540,"Bakersfield, CA Metro Area",287775,257737,30038,6622,3200,20216,887,33,0.104380158109634
12580,31000US12580,"Baltimore-Columbia-Towson, MD Metro Area",1140939,1032863,108076,24262,14015,69799,1141,30.8999996185303,0.094725484885695
12620,31000US12620,"Bangor, ME Metro Area",74116,62215,11901,1249,746,9906,730,33.0999984741211,0.160572615899401
12660,31000US12660,"Baraboo, WI Micro Area",29794,25400,4394,516,363,3515,737,29.3999996185303,0.147479358260052
12680,31000US12680,"Bardstown, KY Micro Area",18327,16660,1667,298,158,1211,673,33.2000007629395,0.090958694821848
12700,31000US12700,"Barnstable Town, MA Metro Area",160953,94371,66582,1917,1764,62901,1101,33.7999992370605,0.413673556876852
12740,31000US12740,"Barre, VT Micro Area",30056,24704,5352,180,209,4963,853,30.1000003814697,0.178067607133351
12780,31000US12780,"Bartlesville, OK Micro Area",23544,21109,2435,261,412,1762,669,27.7000007629395,0.103423377505946
12820,31000US12820,"Bastrop, LA Micro Area",12463,10383,2080,300,105,1675,548,32,0.166894006258525
12860,31000US12860,"Batavia, NY Micro Area",25627,23967,1660,208,105,1347,722,29.5,0.064775432161392
12900,31000US12900,"Batesville, AR Micro Area",16205,14405,1800,262,219,1319,590,31.7999992370605,0.111076828139463
12940,31000US12940,"Baton Rouge, LA Metro Area",336104,299156,36948,8334,3915,24699,817,31.7999992370605,0.109930259681527
12980,31000US12980,"Battle Creek, MI Metro Area",60832,52842,7990,1730,1108,5152,685,30.1000003814697,0.131345344555497
13020,31000US13020,"Bay City, MI Metro Area",48100,43712,4388,633,805,2950,650,33.2999992370605,0.091226611226611
13060,31000US13060,"Bay City, TX Micro Area",18898,13143,5755,654,142,4959,662,27.6000003814697,0.30452957984972
13100,31000US13100,"Beatrice, NE Micro Area",10413,9119,1294,401,28,865,631,25,0.12426774224527
13140,31000US13140,"Beaumont-Port Arthur, TX Metro Area",172119,149713,22406,5525,1979,14902,749,30.1000003814697,0.130177377279673
13180,31000US13180,"Beaver Dam, WI Micro Area",37102,32979,4123,1235,715,2173,759,26.8999996185303,0.111126084847178
13220,31000US13220,"Beckley, WV Metro Area",57539,48730,8809,802,671,7336,621,26.7999992370605,0.153096160864805
13260,31000US13260,"Bedford, IN Micro Area",20992,18561,2431,516,354,1561,621,28,0.115806021341463
13300,31000US13300,"Beeville, TX Micro Area",10671,8933,1738,216,105,1417,781,27.2000007629395,0.162871333520757
13340,31000US13340,"Bellefontaine, OH Micro Area",23152,18471,4681,322,320,4039,707,28,0.202185556323428
13380,31000US13380,"Bellingham, WA Metro Area",91447,79837,11610,1428,735,9447,919,33.5999984741211,0.126958784869925
13420,31000US13420,"Bemidji, MN Micro Area",20635,16793,3842,435,76,3331,661,30.5,0.186188514659559
13460,31000US13460,"Bend-Redmond, OR Metro Area",80945,64917,16028,1903,1173,12952,931,33.4000015258789,0.198010995120143
13500,31000US13500,"Bennettsville, SC Micro Area",12017,9645,2372,479,155,1738,552,33.4000015258789,0.197387035033702
13540,31000US13540,"Bennington, VT Micro Area",20929,15477,5452,176,122,5154,872,32.2999992370605,0.260499784987338
13620,31000US13620,"Berlin, NH-VT Micro Area",26308,17147,9161,262,254,8645,676,29.2000007629395,0.348221073437738
13660,31000US13660,"Big Rapids, MI Micro Area",21085,15529,5556,293,398,4865,622,35.2999992370605,0.263504861275788
13700,31000US13700,"Big Spring, TX Micro Area",13709,11662,2047,179,111,1757,726,24.3999996185303,0.149317966299511
13720,31000US13720,"Big Stone Gap, VA Micro Area",27304,23372,3932,616,352,2964,592,34.7999992370605,0.144008203926165
13740,31000US13740,"Billings, MT Metro Area",72031,66009,6022,1301,384,4337,736,28.3999996185303,0.083602893198762
13780,31000US13780,"Binghamton, NY Metro Area",112325,99616,12709,2238,1180,9291,694,32.2999992370605,0.113144892054307
13820,31000US13820,"Birmingham-Hoover, AL Metro Area",503430,435724,67706,11598,8396,47712,797,31,0.134489402697495
13900,31000US13900,"Bismarck, ND Metro Area",52653,49468,3185,377,528,2280,710,24.1000003814697,0.060490380415171
13940,31000US13940,"Blackfoot, ID Micro Area",16167,14840,1327,237,147,943,617,24.2999992370605,0.08208078183955
13980,31000US13980,"Blacksburg-Christiansburg-Radford, VA Metro Area",78784,68600,10184,1397,920,7867,773,35.2000007629395,0.129264825345248
14010,31000US14010,"Bloomington, IL Metro Area",78004,71161,6843,1939,1003,3901,757,28.2999992370605,0.087726270447669
14020,31000US14020,"Bloomington, IN Metro Area",69536,62317,7219,1416,809,4994,808,38.2000007629395,0.103816728025771
14100,31000US14100,"Bloomsburg-Berwick, PA Metro Area",37608,33793,3815,197,238,3380,712,30.5,0.101441182727079
14140,31000US14140,"Bluefield, WV-VA Micro Area",50698,43896,6802,835,599,5368,579,30.1000003814697,0.134167028285139
14180,31000US14180,"Blytheville, AR Micro Area",20461,17188,3273,808,153,2312,617,32.0999984741211,0.159962856165388
14220,31000US14220,"Bogalusa, LA Micro Area",21171,17589,3582,419,325,2838,567,36.2000007629395,0.169193708374663
14260,31000US14260,"Boise City, ID Metro Area",250085,232248,17837,3370,3668,10799,813,29.8999996185303,0.071323749925026
14340,31000US14340,"Boone, IA Micro Area",11771,10619,1152,200,84,868,642,26.8999996185303,0.097867640812166
14380,31000US14380,"Boone, NC Micro Area",32561,20224,12337,1615,427,10295,822,50,0.378888854764903
14420,31000US14420,"Borger, TX Micro Area",10591,8390,2201,286,200,1715,703,26.8999996185303,0.207817958644132
14460,31000US14460,"Boston-Cambridge-Newton, MA-NH Metro Area",1890680,1764845,125835,29255,11902,84678,1219,30,0.066555419214251
14500,31000US14500,"Boulder, CO Metro Area",128600,121526,7074,1423,893,4758,1149,34.7999992370605,0.055007776049767
14540,31000US14540,"Bowling Green, KY Metro Area",70168,62821,7347,1124,733,5490,666,29.7999992370605,0.104705848819975
14580,31000US14580,"Bozeman, MT Micro Area",43288,37495,5793,894,493,4406,850,30.1000003814697,0.1338246165219
14620,31000US14620,"Bradford, PA Micro Area",21136,17340,3796,176,315,3305,613,30.8999996185303,0.179598788796366
14660,31000US14660,"Brainerd, MN Micro Area",65450,39530,25920,392,850,24678,704,29.1000003814697,0.396027501909855
14700,31000US14700,"Branson, MO Micro Area",50300,33733,16567,915,904,14748,689,30.8999996185303,0.329363817097415
14720,31000US14720,"Breckenridge, CO Micro Area",30078,10386,19692,1564,477,17651,1143,29.2999992370605,0.654697785757032
14740,31000US14740,"Bremerton-Silverdale, WA Metro Area",108282,97993,10289,2565,1306,6418,1043,31.1000003814697,0.095020409671044
14780,31000US14780,"Brenham, TX Micro Area",15628,11917,3711,468,281,2962,791,26.3999996185303,0.237458407985667
14820,31000US14820,"Brevard, NC Micro Area",19285,13735,5550,312,276,4962,647,30.8999996185303,0.287788436608763
14860,31000US14860,"Bridgeport-Stamford-Norwalk, CT Metro Area",362616,333502,29114,7540,3837,17737,1327,32.5999984741211,0.08028879034571
15020,31000US15020,"Brookhaven, MS Micro Area",15262,13091,2171,267,130,1774,627,33,0.142248722316865
15060,31000US15060,"Brookings, OR Micro Area",12618,10296,2322,259,312,1751,825,32.7000007629395,0.184022824536377
15100,31000US15100,"Brookings, SD Micro Area",13475,12318,1157,298,74,785,666,29.8999996185303,0.085862708719852
15180,31000US15180,"Brownsville-Harlingen, TX Metro Area",144180,119695,24485,4943,1391,18151,648,32.7000007629395,0.169822444167013
15220,31000US15220,"Brownwood, TX Micro Area",18375,13329,5046,650,195,4201,661,29.1000003814697,0.274612244897959
15260,31000US15260,"Brunswick, GA Metro Area",58478,43257,15221,1576,891,12754,788,29.2999992370605,0.260285919491091
15340,31000US15340,"Bucyrus, OH Micro Area",20082,17625,2457,194,274,1989,642,27.6000003814697,0.122348371676128
15380,31000US15380,"Buffalo-Cheektowaga-Niagara Falls, NY Metro Area",519721,470035,49686,11094,5203,33389,725,30,0.095601293771081
15420,31000US15420,"Burley, ID Micro Area",16110,14848,1262,314,89,859,562,25.6000003814697,0.078336436995655
15460,31000US15460,"Burlington, IA-IL Micro Area",22314,19997,2317,595,158,1564,625,28.2999992370605,0.103836156672941
15500,31000US15500,"Burlington, NC Metro Area",67487,61046,6441,2096,805,3540,743,30.8999996185303,0.095440603375465
15540,31000US15540,"Burlington-South Burlington, VT Metro Area",93375,84818,8557,929,778,6850,1027,32.4000015258789,0.091641231593039
15580,31000US15580,"Butte-Silver Bow, MT Micro Area",16774,15275,1499,264,249,986,595,30,0.089364492667223
15620,31000US15620,"Cadillac, MI Micro Area",25788,18587,7201,340,457,6404,713,31.2999992370605,0.279238405459904
15660,31000US15660,"Calhoun, GA Micro Area",22241,19320,2921,772,682,1467,671,30.2999992370605,0.131334022750776
15680,31000US15680,"California-Lexington Park, MD Metro Area",42330,37947,4383,882,572,2929,1259,26.2000007629395,0.103543586109142
15700,31000US15700,"Cambridge, MD Micro Area",16652,13419,3233,183,199,2851,842,32.7999992370605,0.19415085275042
15740,31000US15740,"Cambridge, OH Micro Area",19127,15564,3563,518,284,2761,591,31,0.186281173210645
15780,31000US15780,"Camden, AR Micro Area",15993,12564,3429,308,42,3079,575,32,0.214406302757456
15820,31000US15820,"Campbellsville, KY Micro Area",10924,9491,1433,276,89,1068,565,33.2999992370605,0.131179055291102
15860,31000US15860,"Ca�on City, CO Micro Area",19199,16600,2599,241,303,2055,697,30.6000003814697,0.135371633939268
15900,31000US15900,"Canton, IL Micro Area",16178,14501,1677,298,130,1249,613,29.2000007629395,0.103659290394363
15940,31000US15940,"Canton-Massillon, OH Metro Area",178914,160678,18236,3302,2012,12922,676,29.1000003814697,0.101926065036833
15980,31000US15980,"Cape Coral-Fort Myers, FL Metro Area",372769,246061,126708,10823,6821,109064,939,32.2999992370605,0.339910239317111
16020,31000US16020,"Cape Girardeau, MO-IL Metro Area",42594,37288,5306,969,753,3584,661,29.5,0.124571535897075
16060,31000US16060,"Carbondale-Marion, IL Metro Area",59236,50229,9007,2845,537,5625,651,34.2000007629395,0.152052805726248
16100,31000US16100,"Carlsbad-Artesia, NM Micro Area",22960,20190,2770,430,62,2278,738,23.7000007629395,0.120644599303136
16180,31000US16180,"Carson City, NV Metro Area",23500,21225,2275,854,185,1236,837,29,0.096808510638298
16220,31000US16220,"Casper, WY Metro Area",34900,31790,3110,619,264,2227,831,26.2000007629395,0.089111747851003
16260,31000US16260,"Cedar City, UT Micro Area",19879,15135,4744,815,475,3454,665,31.2999992370605,0.238643794959505
16300,31000US16300,"Cedar Rapids, IA Metro Area",113464,105376,8088,2255,1458,4375,676,26.6000003814697,0.071282521328351
16340,31000US16340,"Cedartown, GA Micro Area",16946,14778,2168,501,403,1264,669,29.5,0.127935796058067
16380,31000US16380,"Celina, OH Micro Area",17655,15923,1732,242,141,1349,650,25.6000003814697,0.098102520532427
16460,31000US16460,"Centralia, IL Micro Area",18212,15835,2377,332,179,1866,626,33.2000007629395,0.130518339556336
16500,31000US16500,"Centralia, WA Micro Area",34112,29450,4662,719,635,3308,782,32,0.136667448405253
16540,31000US16540,"Chambersburg-Waynesboro, PA Metro Area",63779,58298,5481,903,1102,3476,801,28.2999992370605,0.085937377506703
16580,31000US16580,"Champaign-Urbana, IL Metro Area",101942,91858,10084,2956,1521,5607,795,34.2999992370605,0.098918993152969
16620,31000US16620,"Charleston, WV Metro Area",108096,95619,12477,2712,1231,8534,675,26.5,0.115425177619893
16660,31000US16660,"Charleston-Mattoon, IL Micro Area",28354,25247,3107,801,194,2112,616,33.7999992370605,0.109578895393948
16700,31000US16700,"Charleston-North Charleston, SC Metro Area",305301,264864,40437,10718,4610,25109,974,33.2000007629395,0.13244961529769
16740,31000US16740,"Charlotte-Concord-Gastonia, NC-SC Metro Area",951731,857926,93805,22478,12986,58341,847,29.8999996185303,0.098562513987671
16820,31000US16820,"Charlottesville, VA Metro Area",98307,85076,13231,2673,657,9901,1050,29.7000007629395,0.134588584739642
16860,31000US16860,"Chattanooga, TN-GA Metro Area",236121,209002,27119,5635,3747,17737,736,29.8999996185303,0.114852130898988
16940,31000US16940,"Cheyenne, WY Metro Area",40971,37364,3607,680,304,2623,783,27,0.088037880452027
16980,31000US16980,"Chicago-Naperville-Elgin, IL-IN-WI Metro Area",3799255,3438560,360695,87308,51791,221596,979,31.2999992370605,0.094938349755413
17020,31000US17020,"Chico, CA Metro Area",96700,85215,11485,1819,939,8727,899,36.5,0.118769389865564
17060,31000US17060,"Chillicothe, OH Micro Area",31933,28209,3724,436,408,2880,662,30,0.116619171390098
17140,31000US17140,"Cincinnati, OH-KY-IN Metro Area",914771,817460,97311,24858,12046,60407,750,29.7000007629395,0.106377443097781
17200,31000US17200,"Claremont-Lebanon, NH-VT Micro Area",122895,89481,33414,1626,1526,30262,872,29,0.271890638349811
17220,31000US17220,"Clarksburg, WV Micro Area",42938,37317,5621,544,819,4258,625,28.3999996185303,0.130909683730029
17260,31000US17260,"Clarksdale, MS Micro Area",10774,9350,1424,412,186,826,572,30.5,0.132170038982736
17300,31000US17300,"Clarksville, TN-KY Metro Area",111135,96607,14528,4217,1920,8391,820,29.2999992370605,0.130723894362712
17340,31000US17340,"Clearlake, CA Micro Area",35576,26771,8805,699,793,7313,921,39.5,0.247498313469755
17380,31000US17380,"Cleveland, MS Micro Area",14160,12377,1783,350,134,1299,576,30.7999992370605,0.125918079096045
17420,31000US17420,"Cleveland, TN Metro Area",50109,44442,5667,1332,822,3513,704,31.3999996185303,0.113093456265342
17460,31000US17460,"Cleveland-Elyria, OH Metro Area",955807,846647,109160,24836,11629,72695,750,31,0.114207156884183
17500,31000US17500,"Clewiston, FL Micro Area",14449,11156,3293,625,183,2485,764,30.7000007629395,0.227905045331857
17540,31000US17540,"Clinton, IA Micro Area",21762,19977,1785,484,192,1109,610,28,0.082023711055969
17580,31000US17580,"Clovis, NM Micro Area",20422,18223,2199,560,441,1198,715,30.6000003814697,0.107677994319851
17620,31000US17620,"Coamo, PR Micro Area",16049,13568,2481,163,178,2140,419,36.2999992370605,0.154589070970154
17640,31000US17640,"Coco, PR Micro Area",13936,11013,2923,94,208,2621,394,36.2999992370605,0.209744546498278
17660,31000US17660,"Coeur d'Alene, ID Metro Area",64525,55807,8718,1193,848,6677,823,30.5,0.135110422316931
17700,31000US17700,"Coffeyville, KS Micro Area",16507,13706,2801,266,514,2021,601,30.1000003814697,0.169685587932392
17740,31000US17740,"Coldwater, MI Micro Area",20682,15863,4819,299,303,4217,672,30.7000007629395,0.233004545014989
17780,31000US17780,"College Station-Bryan, TX Metro Area",97815,84436,13379,4047,1174,8158,849,39.2999992370605,0.136778612687216
17820,31000US17820,"Colorado Springs, CO Metro Area",269555,249765,19790,4624,3045,12121,941,30.3999996185303,0.07341729888149
17860,31000US17860,"Columbia, MO Metro Area",71232,66136,5096,1179,426,3491,798,34,0.071540880503145
17900,31000US17900,"Columbia, SC Metro Area",336587,296439,40148,8683,4726,26739,837,31.1000003814697,0.119279710743433
17980,31000US17980,"Columbus, GA-AL Metro Area",130160,111394,18766,5123,2447,11196,813,31.1000003814697,0.144176398279041
18020,31000US18020,"Columbus, IN Metro Area",33280,30516,2764,434,476,1854,807,26.3999996185303,0.083052884615385
18060,31000US18060,"Columbus, MS Micro Area",26784,23431,3353,553,210,2590,706,34.2999992370605,0.125186678614098
18100,31000US18100,"Columbus, NE Micro Area",13505,12666,839,220,80,539,643,22.5,0.062125138837468
18140,31000US18140,"Columbus, OH Metro Area",829386,748544,80842,20732,9366,50744,822,29.2000007629395,0.09747210587109
18180,31000US18180,"Concord, NH Micro Area",63589,57040,6549,797,562,5190,942,30.7000007629395,0.10298951076444
18220,31000US18220,"Connersville, IN Micro Area",10848,9336,1512,664,304,544,634,33.7999992370605,0.139380530973451
18260,31000US18260,"Cookeville, TN Micro Area",48485,42694,5791,1350,306,4135,594,33.7000007629395,0.11943900175312
18300,31000US18300,"Coos Bay, OR Micro Area",30511,25847,4664,838,558,3268,728,33.7000007629395,0.152862901904231
18380,31000US18380,"Cordele, GA Micro Area",10719,8574,2145,325,165,1655,589,38.2999992370605,0.200111950741674
18420,31000US18420,"Corinth, MS Micro Area",17097,14651,2446,352,213,1881,608,29,0.143066034976897
18460,31000US18460,"Cornelia, GA Micro Area",18136,14613,3523,586,610,2327,675,30.5,0.194254521393913
18500,31000US18500,"Corning, NY Micro Area",48859,41285,7574,483,354,6737,664,25.7999992370605,0.155017499334821
18580,31000US18580,"Corpus Christi, TX Metro Area",185324,157629,27695,4817,1746,21132,857,29.7999992370605,0.14944097904211
18620,31000US18620,"Corsicana, TX Micro Area",20364,17660,2704,219,411,2074,697,29.1000003814697,0.132783343154587
18660,31000US18660,"Cortland, NY Micro Area",20554,18045,2509,259,126,2124,675,27.6000003814697,0.122068697090591
18700,31000US18700,"Corvallis, OR Metro Area",36701,33376,3325,1186,128,2011,845,39,0.090596986458135
18740,31000US18740,"Coshocton, OH Micro Area",16442,14561,1881,356,213,1312,571,28,0.114402140858776
18780,31000US18780,"Craig, CO Micro Area",6181,4890,1291,269,251,771,739,32.0999984741211,0.208865879307555
18820,31000US18820,"Crawfordsville, IN Micro Area",16528,14574,1954,358,357,1239,672,28.6000003814697,0.118223620522749
18860,31000US18860,"Crescent City, CA Micro Area",11270,9527,1743,164,177,1402,843,33.4000015258789,0.154658385093168
18880,31000US18880,"Crestview-Fort Walton Beach-Destin, FL Metro Area",139731,96293,43438,4313,1523,37602,1011,31.7000007629395,0.310868740651681
18900,31000US18900,"Crossville, TN Micro Area",28373,23923,4450,295,620,3535,635,30.6000003814697,0.156839248581398
18980,31000US18980,"Cullman, AL Micro Area",37084,31160,5924,460,499,4965,621,31.7000007629395,0.159745442778557
19000,31000US19000,"Cullowhee, NC Micro Area",26186,15872,10314,407,245,9662,620,34.7000007629395,0.393874589475292
19060,31000US19060,"Cumberland, MD-WV Metro Area",46366,39638,6728,1010,919,4799,573,30.7000007629395,0.145106327912695
19100,31000US19100,"Dallas-Fort Worth-Arlington, TX Metro Area",2581840,2370055,211785,88321,23111,100353,923,29.1000003814697,0.0820287082081
19140,31000US19140,"Dalton, GA Metro Area",55645,48754,6891,2410,904,3577,670,30.7000007629395,0.123838619822086
19180,31000US19180,"Danville, IL Metro Area",36137,31601,4536,1345,830,2361,634,29.2999992370605,0.125522317845975
19220,31000US19220,"Danville, KY Micro Area",23217,20674,2543,251,404,1888,615,29.5,0.109531808588534
19260,31000US19260,"Danville, VA Micro Area",53734,44549,9185,1223,641,7321,599,29.1000003814697,0.170934603789035
19300,31000US19300,"Daphne-Fairhope-Foley, AL Metro Area",105563,73058,32505,9448,2850,20207,882,31.2000007629395,0.307920388772581
19340,31000US19340,"Davenport-Moline-Rock Island, IA-IL Metro Area",167808,154591,13217,3349,2149,7719,681,28.2000007629395,0.078762633485889
19380,31000US19380,"Dayton, OH Metro Area",367492,327391,40101,8909,4837,26355,751,30.3999996185303,0.109120742764468
19420,31000US19420,"Dayton, TN Micro Area",14387,12307,2080,398,129,1553,577,32.2000007629395,0.144574963508723
19460,31000US19460,"Decatur, AL Metro Area",66514,59168,7346,596,930,5820,603,26.5,0.110442914273687
19500,31000US19500,"Decatur, IL Metro Area",50424,45153,5271,1205,737,3329,665,29.5,0.104533555449786
19540,31000US19540,"Decatur, IN Micro Area",13073,12164,909,329,197,383,550,28.2999992370605,0.06953262449323
